<!--
    Copyright (c) 2008, 2021 SAP AG and others
    All rights reserved. This program and the accompanying materials
    are made available under the terms of the Eclipse Public License 2.0
    which accompanies this distribution, and is available at
    https://www.eclipse.org/legal/epl-2.0/

    SPDX-License-Identifier: EPL-2.0
   
    Contributors:
        SAP AG - initial implementation
 -->
 <section name="Regression Tests" xmlns:xsi="http://www.w3.org/2001/XMLSchema-instance"
	xmlns="http://www.eclipse.org/mat/report.xsd"
	xsi:schemaLocation="http://www.eclipse.org/mat/report.xsd ../../../org.eclipse.mat.report/schema/report.xsd">
	<query name="info">
		<param key="format" value="csv" />
		<param key="filename" value="info.csv" />
		<param key="html.separate_file" value="true" />
		<param key="html.show_table_header" value="false" />
		<command>heap_dump_overview</command>
	</query>
	<query name="System Properties">
		<param key="format" value="csv" />
		<param key="filename" value="System_Properties.csv" />
		<param key="html.separate_file" value="true" />
		<param key="sort_column" value="Key=ASC" />
		<param key="limit" value="1000" />
		<command>system_properties</command>
	</query>
	<query name="Class Histogram">
	    <param key="format" value="csv" />
		<param key="filename" value="Class_Histogram.csv" />
		<param key="html.separate_file" value="true" />
		<param key="sort_column" value="#3=DESC,#2=DESC,#1=DESC,#0" />
		<param key="derived_data_column" value="_default_=APPROXIMATE" />
		<param key="limit" value="50000" />
		<command>histogram</command>
	</query>
	<query name="Class Loader Histogram">
	    <param key="format" value="csv" />
		<param key="filename" value="Class_Loader_Histogram.csv" />
		<param key="html.separate_file" value="true" />
		<param key="sort_column" value="#3=DESC,#2=DESC,#1=DESC,#0" />
		<param key="derived_data_column" value="_default_=APPROXIMATE" />
		<param key="limit" value="50000" />
		<command>histogram -groupBy BY_CLASSLOADER</command>
	</query>
	<query name="Dominator Tree">
		<param key="format" value="csv" />
		<param key="filename" value="Dominator_Tree.csv" />
		<param key="html.separate_file" value="true" />
		<param key="sort_column" value="#2=DESC,#1=DESC,#0" />
		<param key="limit" value="50000" />
		<command>dominator_tree</command>
	</query>
	<query name="Dominator Tree (binary)">
		<command>dom_tree_binary_test</command>
	</query>
	<query name="List 1000 Strings">
		<param key="format" value="csv" />
		<param key="filename" value="List_1000_Strings.csv" />
		<param key="html.separate_file" value="true" />
		<param key="sort_column" value="ADDRESS" />
		<param key="limit" value="1000" />
		<command>oql "select s.@objectAddress as ADDRESS, toString(s)as VALUE from java.lang.String s"</command>
	</query>
	<query name="Paths from GC Roots">
		<param key="format" value="csv" />
		<param key="filename" value="Paths_from_GC_Root.csv" />
		<param key="html.separate_file" value="true" />
		<param key="limit" value="100" />
		<!--  Test sorting by non-existing columns -->
		<param key="sort_column" value="NOT EXIST" />
		<command>path2gc_reg_test</command>
	</query>
	<query name="Merged Paths from GC Roots">
		<param key="filename" value="Merged_Paths_from_GC_Roots.csv" />
		<param key="format" value="csv" />
		<param key="html.separate_file" value="true" />
		<param key="limit" value="1000" />
		<command>merged_paths_reg_test</command>
	</query>
	<query name="Immediate Dominators of java.util.HashMap$Entry">
		<param key="filename" value="Immediate_Dominators_of_java.util.HashMap$Entry.csv" />
		<param key="format" value="csv" />
		<param key="html.separate_file" value="true" />
		<param key="sort_column" value="#4=DESC,#3=DESC,#2=DESC,#1=DESC,#0" />
		<param key="limit" value="1000" />
		<command>immediate_dominators java.util.HashMap$Entry</command>
	</query>
	<query name="Thread Overview">
		<param key="filename" value="Thread_Overview.csv" />
		<param key="format" value="csv" />
		<param key="html.separate_file" value="true" />
		<param key="sort_column" value="Name,Object / Stack Frame" />
		<param key="limit" value="1000" />
		<command>thread_overview</command>
	</query>
</section>
