<!--
    Copyright (c) 2008, 2021 SAP AG and others
    All rights reserved. This program and the accompanying materials
    are made available under the terms of the Eclipse Public License 2.0
    which accompanies this distribution, and is available at
    https://www.eclipse.org/legal/epl-2.0/

    SPDX-License-Identifier: EPL-2.0
   
    Contributors:
        SAP AG - initial implementation
 -->
 <section name="Performance Tests"  xmlns:xsi="http://www.w3.org/2001/XMLSchema-instance"
	xmlns="http://www.eclipse.org/mat/report.xsd"
	xsi:schemaLocation="http://www.eclipse.org/mat/report.xsd ../../../org.eclipse.mat.report/schema/report.xsd">
	<query name="Paths from GC Roots">
		<param key="html.separate_file" value="true" />
		<param key="limit" value="100" />
		<command>path2gc_reg_test</command>
	</query>
	<query name="Merged Paths from GC Roots">
		<param key="html.separate_file" value="true" />
		<param key="limit" value="1000" />
		<command>merged_paths_reg_test</command>
	</query>
	<query name="Retained Size Approx for Histogram">
		<param key="html.separate_file" value="true" />
		<param key="limit" value="50000" />
		<command>retained_size_histogram_test -approx</command>
	</query>
	<query name="Retained Size Approx for Classloaders">
		<param key="html.separate_file" value="true" />
		<param key="limit" value="50000" />
		<command>retained_size_histogram_test -byClassLoader -approx</command>
	</query>
	<query name="Retained Size for Histogram(precise)">
		<param key="html.separate_file" value="true" />
		<param key="limit" value="50000" />
		<command>retained_size_histogram_test</command>
	</query>
	<query name="Retained Size for Classloaders(precise)">
		<param key="html.separate_file" value="true" />
		<param key="limit" value="50000" />
		<command>retained_size_histogram_test -byClassLoader</command>
	</query>
	<query name="Immediate Dominators of java.util.HashMap$Entry">
		<param key="html.separate_file" value="true" />
		<param key="limit" value="1000" />
		<command>immediate_dominators java.util.HashMap$Entry</command>
	</query>
</section>
