<section name="Enterprise Java" xmlns:xsi="http://www.w3.org/2001/XMLSchema-instance"
        xmlns="http://www.eclipse.org/mat/report.xsd"
        xsi:schemaLocation="http://www.eclipse.org/mat/report.xsd ../../../org.eclipse.mat.report/schema/report.xsd"
        >
    <!-- 
    <param key="html.collapsed" value="false" />
    <param key="filename_suffix" value="%suspects.suffix" />

    <section name="%overview.title">
            <param key="html.separate_file" value="true" />
            <template>org.eclipse.mat.api:overview</template>
    </section>
 -->
    <query name="HTTP Sessions">
        <command>javaee-http-sessions</command>
    </query>
    <query name="HTTP Session attributes">
        <command>javaee-http-session-attributes</command>
    </query>
    <query name="HTTP Requests">
        <command>javaee-http-requests</command>
    </query>
    <query name="Servlets">
        <command>javaee-servlets</command>
    </query>
    <query name="Stateful EJBs">
        <command>javaee-ejb-stateful</command>
    </query>
    <query name="Stateless EJBs">
        <command>javaee-ejb-less</command>
    </query>
</section>